Tipo_Documento,Numero_Documento,Nome,RG,Situação,Cargo,Orgao_Lotacao,Diario_Fonte,Substituto_Nome,Titular_Ferias_Nome,Periodo_Ferias
DECRETO,8.208,Verificar Anexo (Nomes em lista separada),Não Encontrado,Nomeação,"Agente Profi ssional, nas funções de Assistente Social e Psicólogo",Secretaria de Estado da Administração e da Previdência – SEAP,Diário 06-12-2024,N/A,N/A,N/A
DECRETO,8.210,Verificar Anexo (Nomes em lista separada),Não Encontrado,Nomeação,"Agente Profi ssional, nas suas respectivas funções",Secretaria de Estado da Administração e da Previdência – SEAP,Diário 06-12-2024,N/A,N/A,N/A
DECRETO,8.213,Verificar Anexo (Nomes em lista separada),Não Encontrado,Nomeação,"Agente Profi ssional, na função de Psicólogo",Secretaria de Estado da Administração e da Previdência – SEAP,Diário 06-12-2024,N/A,N/A,N/A
PORTARIA,630,Saonara do Rocio Porto,3.xxx.802 -x,Designação (Substituição por Férias),Gerente Regional de Bacia Hidrográfica – Escritório de Guarapuava - ERGUA,Instituto Água e Terra - IAT,Diário 06-12-2024,Saonara do Rocio Porto,Marco Antonio Silva,04 a 18 de dezembro de 2024
PORTARIA,646,Patrícia Accioly Calderari da Rosa,6.xxx.280- x,Designação (Substituição por Férias),Diretor a do Patrimônio Natural – DIPAN,Instituto Água e Terra - IAT,Diário 06-12-2024,Patrícia Accioly Calderari da Rosa,Rafael Andreguetto,05 de dezembro a 03 de janeir o de 202 5
