Tipo_Documento,Numero_Documento,Nome,RG,Situação,Cargo,Orgao_Lotacao,Diario_Fonte,Substituto_Nome,Titular_Ferias_Nome,Periodo_Ferias
DECRETO,8.208,Verificar Anexo (Nomes em lista separada),Não Encontrado,Nomeação,"Agente Proﬁ ssional, nas funções de Assistente Social e Psicólogo",Secretaria de Estado da Administração e da Previdência – SEAP,Diário 06-12-2024,N/A,N/A,N/A
DECRETO,8.210,Verificar Anexo (Nomes em lista separada),Não Encontrado,Nomeação,"Agente Proﬁ ssional, nas suas respectivas funções",Secretaria de Estado da Administração e da Previdência – SEAP,Diário 06-12-2024,N/A,N/A,N/A
DECRETO,8.213,Verificar Anexo (Nomes em lista separada),Não Encontrado,Nomeação,"Agente Proﬁ ssional, na função de Psicólogo",Secretaria de Estado da Administração e da Previdência – SEAP,Diário 06-12-2024,N/A,N/A,N/A
PORTARIA,646,Patrícia  Accioly Calderari da Rosa,6.xxx.280-,Designação,"Diretor a do Patrimônio Natural – de férias do titular Rafael Andreguetto , RG nº 4.xxx.581- x. Diretor -Presidente do Instituto Água e Terra INSTITUTO ÁGUA E TERRA",Instituto Água e Terra - IAT,Diário 06-12-2024,N/A,N/A,N/A
PORTARIA,630,Saonara do Rocio Porto,3.xxx.802,Designação (Substituição por Férias),Gerente Regional de Bacia Hidrográfica – de 2024,Instituto Água e Terra - IAT,Diário 06-12-2024,Saonara do Rocio Porto,N/A,N/A
